<!ELEMENT joda-holiday-information (locale-holiday-information*)>
<!ELEMENT holiday-information (id,week?,day*)>
<!ATTLIST holiday-information
  id CDATA #REQUIRED
  base CDATA #IMPLIED
  visible (true|false) 'true'>
<!ELEMENT week (weekendStart,weekendEnd)>
<!ELEMENT weekendStart (#PCDATA)>
<!ELEMENT weekendEnd (#PCDATA)>
<!ELEMENT name (#PCDATA)>
<!ATTLIST name lang CDATA #REQUIRED>
<!ELEMENT day (name*,dayRule*,holidayRule*)>
<!ATTLIST day id CDATA #REQUIRED>
<!ELEMENT dayRule EMPTY>
<!ATTLIST dayRule
  repeat CDATA 'P1Y'
  fromYear CDATA #IMPLIED
  toYear CDATA #IMPLIED
  year CDATA #IMPLIED
  basedOn CDATA #IMPLIED
  relativeDays CDATA #IMPLIED
  monthOfYear CDATA #IMPLIED
  dayOfMonth CDATA #IMPLIED
  weekOfMonth CDATA #IMPLIED
  dayOfWeek CDATA #IMPLIED
  weekendAdjust (NextWeekday|PreviousWeekday|NearestWeekday) #IMPLIED
  duration CDATA 'P1D'>
<!ELEMENT holidayRule EMPTY>
<!ATTLIST holidayRule
  repeat CDATA 'P1Y'
  fromYear CDATA #IMPLIED
  toYear CDATA #IMPLIED
  year CDATA #IMPLIED
  basedOn CDATA #IMPLIED
  relativeDays CDATA #IMPLIED
  monthOfYear CDATA #IMPLIED
  dayOfMonth CDATA #IMPLIED
  weekOfMonth CDATA #IMPLIED
  dayOfWeek CDATA #IMPLIED
  weekendAdjust (NextWeekday|PreviousWeekday|NearestWeekday) #IMPLIED
  duration CDATA 'P1D'>
